{
    "id": "id",
    "name": "AMLight",
    "start_time": "2000-01-23T04:56:07.000Z",
    "end_time": "2000-01-23T04:56:07.000Z",
    "bandwidth_required": 100,
    "latency_required": 20,
    "egress_port":
    {
        "id": "urn:sdx:port:amlight.net:A1:1",
        "name": "Novi100:1"
    },
    "ingress_port":
    {
        "id": "urn:ogf:network:sdx:port:zaoxi:A1:2",
        "name": "Novi100:2"
    }
}